{
  "report_id": "任何 UUID",
  "schema_version": "CTRS-v1.2",
  "type": "CommercialTrustReport",
  "created_at": "任何 ISO 8601 时间戳",
  "status": "eligible",
  "issuer": {
    "id": "任何 issuer id",
    "name": "任何 issuer name"
  },
  "claim": {
    "claim_id": "claim-001-basic",
    "type": "single_agent_conversion",
    "subject": "用户通过单一 Agent 完成产品推荐并购买",
    "description": "Agent A 推荐产品，用户完成购买。交易金额 $500。",
    "timestamp": "2026-07-01T10:00:00+00:00",
    "parties": [
      {
        "id": "agent-a",
        "role": "recommender",
        "name": "推荐 Agent"
      },
      {
        "id": "user-001",
        "role": "buyer",
        "name": "用户A"
      }
    ]
  },
  "evidence": [
    {
      "evidence_id": "任何 UUID",
      "claim_ref": "claim-001-basic",
      "type": "conversation",
      "source": "agent-a",
      "timestamp": "2026-07-01T10:00:00+00:00",
      "data": {
        "conversation_id": "conv-001",
        "agent_id": "agent-a",
        "user_id": "user-001",
        "action": "recommend_product",
        "product": "智能手环 SmartBand S1",
        "timestamp": "2026-07-01T10:00:00+00:00",
        "message": "推荐 SmartBand S1，售价 $500"
      },
      "hash": "fa12fe557fe4f787022e58bb2015a4584bf901db376a1015af6b3dd894afdda1"
    }
  ],
  "rule": {
    "rule_id": "rule-single-agent-v1",
    "issuer": "did:fly:demo-platform",
    "version": "1.0.0",
    "hash": "4eeede5dee38e7cd466b6a21aed75b0e9883ac74783b7682b3ff99dfe3e8c1e5",
    "definition": {
      "name": "单Agent全额归因规则",
      "method": "proportional",
      "description": "单一 Agent 获得 100% 归因",
      "parameters": {
        "total_value": "500",
        "currency": "USD",
        "splits": {
          "agent-a": "100"
        }
      }
    },
    "created_at": "2026-07-01T09:00:00+00:00"
  },
  "attribution": {
    "attribution_id": "任何 UUID",
    "claim_ref": "claim-001-basic",
    "rule_hash": "4eeede5dee38e7cd466b6a21aed75b0e9883ac74783b7682b3ff99dfe3e8c1e5",
    "method": "proportional",
    "confidence": 1.0,
    "result": [
      {
        "party_id": "agent-a",
        "contribution_pct": "100",
        "attributed_value": "500"
      }
    ],
    "reasoning": "单 Agent 100% 归因",
    "attributed_at": "任何 ISO 8601 时间戳"
  },
  "settlement": {
    "settlement_id": "任何 UUID",
    "attribution_ref": "等于 attribution.attribution_id",
    "status": "eligible",
    "amount": "500",
    "currency": "USD",
    "split": [
      {
        "party_id": "agent-a",
        "share_pct": "100",
        "share_amount": "500"
      }
    ],
    "eligible_parties": [
      "agent-a"
    ]
  }
}