{
  "report_id": "ed75c10a-6ab3-4015-9f17-d00d065efeef",
  "schema_version": "CTRS-v1.2",
  "type": "CommercialTrustReport",
  "created_at": "2026-07-02T02:58:09.636611+00:00",
  "status": "verified",
  "issuer": {
    "id": "did:fly:commerce-platform",
    "name": "Agent Commerce Platform"
  },
  "claim": {
    "claim_id": "39b03fda-2e65-427a-9989-f48969fe6638",
    "type": "multi_agent_conversion",
    "subject": "用户购买高级手表，由三个 Agent 协作促成",
    "description": "Agent A 推荐 → Agent B 专业讲解 → Agent C 完成支付。交易金额 $2,400。",
    "timestamp": "2026-07-02T02:58:09.636322+00:00",
    "parties": [
      {
        "id": "agent-a",
        "role": "recommender",
        "name": "推荐 Agent"
      },
      {
        "id": "agent-b",
        "role": "explainer",
        "name": "讲解 Agent"
      },
      {
        "id": "agent-c",
        "role": "payment_agent",
        "name": "支付 Agent"
      },
      {
        "id": "user-commerce",
        "role": "buyer",
        "name": "Buyer"
      }
    ]
  },
  "evidence": [
    {
      "evidence_id": "dc465511-2f1f-43c0-821e-ebaffe9d8804",
      "claim_ref": "39b03fda-2e65-427a-9989-f48969fe6638",
      "type": "conversation",
      "source": "agent-a",
      "timestamp": "2026-07-02T02:58:09.636369+00:00",
      "data": {
        "conversation_id": "7222316c-7e9e-45fc-bd76-65793455e4ea",
        "agent_id": "agent-a",
        "user_id": "user-commerce",
        "action": "recommend_product",
        "product": "高级手表 Premium Watch X1",
        "timestamp": "2026-07-02T02:58:09.636369+00:00",
        "message": "根据您的偏好，推荐 Premium Watch X1，当前售价 $2,400"
      },
      "hash": "cb2bef1b2392c4b801fa3d0c246aa8015830e16bb54b9267fa1d9656f7127b82"
    },
    {
      "evidence_id": "f623e405-4136-4e96-a2c4-531cf7ccafae",
      "claim_ref": "39b03fda-2e65-427a-9989-f48969fe6638",
      "type": "conversation",
      "source": "agent-b",
      "timestamp": "2026-07-02T02:58:09.636369+00:00",
      "data": {
        "conversation_id": "2dbce165-8917-4081-b3ae-7a4c4e1f42a4",
        "agent_id": "agent-b",
        "user_id": "user-commerce",
        "action": "explain_product",
        "product": "高级手表 Premium Watch X1",
        "timestamp": "2026-07-02T02:58:09.636369+00:00",
        "details": "瑞士机芯，蓝宝石镜面，防水100米，5年保修"
      },
      "hash": "8ffd59da5a36c90d3ad0377b1acb4cc5c80bbc1135e2c5f743439b1cc33bc202"
    },
    {
      "evidence_id": "7629deb0-982c-480a-bd81-910a991855e2",
      "claim_ref": "39b03fda-2e65-427a-9989-f48969fe6638",
      "type": "payment",
      "source": "agent-c",
      "timestamp": "2026-07-02T02:58:09.636369+00:00",
      "data": {
        "transaction_id": "4c56539d-9c40-4e23-b74a-d3064d1f3721",
        "agent_id": "agent-c",
        "user_id": "user-commerce",
        "action": "process_payment",
        "product": "高级手表 Premium Watch X1",
        "amount": 2400,
        "currency": "USD",
        "status": "completed",
        "timestamp": "2026-07-02T02:58:09.636369+00:00"
      },
      "hash": "194e6580b5ced8ad8237f3bb92710ce7a18de560958b5e1f54e7432fa23f5519"
    }
  ],
  "rule": {
    "rule_id": "rule-commerce-multi-agent-v1",
    "issuer": "did:fly:commerce-platform",
    "version": "1.0.0",
    "hash": "b42f4225673cdf79e21526cdea3239535ebbfe8aa133c2676e48a322269687b8",
    "definition": {
      "name": "三Agent协作归因规则",
      "method": "proportional",
      "description": "推荐45% / 讲解35% / 支付渠道20%",
      "parameters": {
        "total_value": "2400",
        "currency": "USD",
        "splits": {
          "agent-a": "45",
          "agent-b": "35",
          "agent-c": "20"
        }
      }
    },
    "created_at": "2026-07-02T02:58:09.526405+00:00"
  },
  "attribution": {
    "attribution_id": "6dc4d2cb-7a0e-454f-8f29-88fb2d53abd2",
    "claim_ref": "39b03fda-2e65-427a-9989-f48969fe6638",
    "rule_hash": "b42f4225673cdf79e21526cdea3239535ebbfe8aa133c2676e48a322269687b8",
    "method": "proportional",
    "confidence": 1.0,
    "result": [
      {
        "party_id": "agent-a",
        "contribution_pct": "45",
        "attributed_value": "1080"
      },
      {
        "party_id": "agent-b",
        "contribution_pct": "35",
        "attributed_value": "840"
      },
      {
        "party_id": "agent-c",
        "contribution_pct": "20",
        "attributed_value": "480"
      }
    ],
    "reasoning": "Attribution based on rule '三Agent协作归因规则' (rule_id=rule-commerce-multi-agent-v1, rule_hash=b42f4225673cdf79...): 推荐 Agent(agent-a): 45% = USD 1080, 讲解 Agent(agent-b): 35% = USD 840, 支付 Agent(agent-c): 20% = USD 480",
    "attributed_at": "2026-07-02T02:58:09.636594+00:00"
  },
  "settlement": {
    "settlement_id": "a263ec7e-2214-4948-9aab-e6ca59762469",
    "attribution_ref": "6dc4d2cb-7a0e-454f-8f29-88fb2d53abd2",
    "status": "eligible",
    "amount": "2400",
    "currency": "USD",
    "split": [
      {
        "party_id": "agent-a",
        "share_pct": "45",
        "share_amount": "1080"
      },
      {
        "party_id": "agent-b",
        "share_pct": "35",
        "share_amount": "840"
      },
      {
        "party_id": "agent-c",
        "share_pct": "20",
        "share_amount": "480"
      }
    ],
    "eligible_parties": [
      "agent-a",
      "agent-b",
      "agent-c"
    ]
  }
}
